"Number","delivery charge","tax","discount","total","date purchased","comments","status","delivery name","delivery phone","delivery company","delivery address","delivery suburb","delivery postcode","delivery state","delivery country","delivery method","billing name","billing email","billing phone","billing company","billing address","billing suburb","billing postcode","billing state","billing country","payment method","product name","code","quantity","price","option","option code"
"3940","70.00","15.45","0.00","1070.90","2013-03-07 17:59:35","test","new","kate test","0123456789","","test address","test city","3101","VIC","22","Do you require a tail gate delivery for $70 plus GST (i.e. you do not have a folk lift for pallet unloading)?","kate test","kate.xue@bwired.com.au","0123456789","","test address","test city","3101","VIC","22","Credit Card Payment via phone","SolarMax S and MT Series","SolarMax","1","900.90","($819) SolarMax 2000 S series","S360-0508"
"3939","70.00","15.45","0.00","406.50","2013-03-07 17:48:22","test","new","kate test","0123456789","","test address","test city","3101","VIC","22","Do you require a tail gate delivery for $70 plus GST (i.e. you do not have a folk lift for pallet unloading)?","kate test","kate.xue@bwired.com.au","0123456789","","test address","test city","3101","VIC","22","Credit Card Payment via phone","Yingli Solar YGE-A 250","0","1","236.50","($0.86/W) Upto 25 units","S360-0485"
"3938","70.00","15.45","0.00","170.00","2013-03-07 17:46:35","test","new","kate test","0123456789","test","test address","test city","3101","VIC","22","Do you require a tail gate delivery for $70 plus GST (i.e. you do not have a folk lift for pallet unloading)?","kate test","kate.xue@bwired.com.au","0123456789","test","test address","test city","3101","VIC","22","Credit Card Payment via phone","Solar-Log 200","S360-0437","1","0.00","",""
"3937","70.00","15.45","0.00","1070.90","2013-03-07 17:36:52","this is for testing pay through credit card, please delete","new","kate test","0123456789","","test address","test city","3101","VIC","22","Do you require a tail gate delivery for $70 plus GST (i.e. you do not have a folk lift for pallet unloading)?","kate test","kate.xue@bwired.com.au","0123456789","","test address","test city","3101","VIC","22","Credit Card Payment via phone","SolarMax S and MT Series","SolarMax","1","900.90","($819) SolarMax 2000 S series","S360-0508"
"3936","0.00","0.00","0.00","14454.00","2013-03-07 17:30:14","Price $0.72 approved by Doug   **** WANT TO PICK UP AT 9.30an tomorrow *****","new","Allan Campbell","0421 986 356","","Innovation Centre, 90 Sippy Downs Drive,","Sippy Downs","4556","QLD","22","Standard Delivery: Amount to be confirmed","Allan Campbell","marcelo.salgado@solar360.com.au","0421 986 356","","Innovation Centre, 90 Sippy Downs Drive,","Sippy Downs","4556","QLD","22","Pay by Direct Deposit","ULICA 250W Mono Panel - Black Frame White Sheet","S360-0281","72","200.75","($0.73/W) from 73 units or more","S360-0281"
